what,when
Development of SenseQuest: a web application for sensory questionnaire,2019
Development of sensehubr: a tidy approach for sensory analyses (R package),2019
Development of SenseXtra: a web application for complementary sensory data preparation,2019
Development of SenseHub: an integrated web application for sensory analyses,2019
Development of Aquastats: a web application for groundwater data analyses,2018
Development of Thermostats: a web application for water daya analyses,2018
Development of MCDM: a web application for conducting Multiple Criteria Decision Making,2018
